,songs
36,"It s like, I just love a cowboy, you know I m just like, I just, I know it s bad, but I m just like Can I just like, hang off the back of your horse And can you go a little faster?! 3 am, mustang speeding Two lovers headed for a dead end Too fast, hold tight, he laughs Running through the red lights Hollering over, rubber spinning Big swig, toss another beer can Too lit, tonight, praying On the moonlight Every John is just the same I m sick of their city games I crave a real wild man I m strung out on John Wayne  Dat - doo - deet - doe   Dat - doo - deet - doe, dat - doo - deet - doe  Baby, let s get high, John Wayne  Dat - doo - deet - doe   Dat - doo - deet - doe, dat - doo - deet - doe  Baby, let s get high, John Wayne Blue collar and a red-state treasure Love junkie on a three-day bender His grip, so hard, eyes glare Trouble like a mug shot Charged up  cause the man s on a mission 1-2 ya, the gears are shifting He called, I cried, we broke Racing through the moonlight Every John is just the same I m sick of their city games I crave a real wild man I m strung out on John Wayne  Dat - doo - deet - doe   Dat - doo - deet - doe, dat - doo - deet - doe  Baby, let s get high, John Wayne  Dat - doo - deet - doe   Dat - doo - deet - doe, dat - doo - deet - doe  Baby, let s get high, John Wayne So here I go to the eye of the storm Just to feel your love Knock me over Here I go into our love storm  Dat - doo - deet - doe   Dat - doo - deet - doe, dat - doo - deet - doe  Baby, let s get high, John Wayne  Dat - doo - deet - doe   Dat - doo - deet - doe, dat - doo - deet - doe  Baby, let s get high, John Wayne "
37,"Fashion! Looking good and feeling fine Looking good and feeling fine Looking good and feeling fine Slay! Slay! Looking good and feeling fine Looking good and feeling fine Looking good and feeling fine Fashion! Step into the room like it s a catwalk Fashion! Singing to the tune, just to keep them talking Fashion! Walk into the light, display your diamonds and pearls in my Fashion! Married to the night, I own the world, we own the world Look at me now I feel on top of the world in my Fashion! Look at me now I feel on top of the world in my Fashion! Looking good and feeling fine Looking good and feeling fine Looking good and feeling fine Slay! Slay! Looking good and feeling fine Looking good and feeling fine Looking good and feeling fine Slay! Slay! You ve got company, make sure you look your best Fashion! Make up on your face, a new designer dress Fashion! There s life on Mars Where the couture is beyond, beyond! Fashion! Married to the stars, I own the world, we own the world Look at me now I feel on top of the world in my Fashion! Look at me now I feel on top of the world in my Fashion! Looking good and feeling fine Looking good and feeling fine Looking good and feeling fine Slay! Slay! Looking good and feeling fine Looking good and feeling fine Looking good and feeling fine Slay! Slay! I take it off I put it on I feel alive when I transform But this love s not material Now take it in and turn me on Zip me up it can t be wrong Cuz your new look s ethereal Looking good and feeling fine Looking good and feeling fine Looking good and feeling fine Looking good and feeling fine Looking good and feeling fine Looking good and feeling fine Fashion! Je me sens en paradis en Fashion! Donnez moi Christian Louboutins Fashion! Le monde est témoin. C est la vie en Fashion! Je suis en haute couture en Fashion! Fashion, fashion! Fashion, fashion! Fashion, fashion! Fashion, fashion! "
38,"Groove slam, work it back Filter that, baby bump that track Groove slam, work it back Filter that, baby bump that track Groove slam, work it back Space Cowboy just play that track Gaga in the room, so starstruck Cherry cherry cherry cherry, boom boom Rollin  up to the club on the weekend Stylin  out to the beat that you re freakin  Fantasize on the track that you re tweakin  Blow my heart up Put your hands on my waist, pull the fader Run it back with original flavor Queue me up, I m the twelve on your table I m so starstruck So starstruck, baby could you blow my heart up? I m so starstruck Baby could you blow my heart up? I m so starstruck Baby could you blow my heart up? I m so starstruck Baby could you blow my heart up? Baby now that we re alone, got a request Would you make me number one on your playlist? Got your dirty headphones with the left side on Wanna scratch it back and forth, back and forth, uhuh Put your hands on my waist, pull the fader Run it back with original flavor Put the breakdown first Up into the to the verse, bick a bick a reverse So starstruck, baby could you blow my heart up? I m so starstruck Baby could you blow my heart up? I m so starstruck Baby could you blow my heart up? I m so starstruck Baby could you blow my heart up? Hey, lived all my life really, really is that him? I haven t seen here before, and she got all them big rims It s it like cash flow, my baby don t trip Should shawty say hand over your signature right here Like a just a dotted line, and I m supposed to sign How she add it up, a fanatic and I think it s going down She s so starstruck, the gal all stuck I shoulda had an overdose on too many Starbucks Ain t neva seen a balla, paper that stack taller Stunna soon let the top back on that Chevy impala Hummers and all that fully loaded with two ballers What do you call that when you re shawty with two daughters? But that s another chapter, slow lover bachelor I don t know me, that s part of the baby actor Complete swagger, there go the dagger Got what she want, shawty happily ever after I m so starstruck, baby could you blow my heart up? I m so starstruck Baby could you blow my heart up? I m so starstruck Baby could you blow my heart up? I m so starstruck Baby could you blow my heart up? Groove slam, work it back Filter that, baby bump that track Groove slam, work it back Filter that, baby bump that track Groove slam, work it back Filter that, baby bump that track Groove slam, work it back Filter that, baby bump that track Baby now that we re alone, got a request Would you make me number one on your playlist? Got your dirty headphones with the left side on Wanna scratch it back and forth, back and forth, uhuh Put your hands on my waist, pull the fader Run it back with original flavor Put the breakdown first Up into the to the verse, I m so, I m so Starstruck, baby could you blow my heart up? I m so starstruck Baby could you blow my heart up? I m so starstruck Baby could you blow my heart up? I m so starstruck Baby could you blow my heart up? I m so, I m so "
39,"Sometimes a story has no end Sometimes I think that we could just be friends "" Cause I m a wandering man,"" he said to me ""And what about our future plans? Does this thing we have even make sense When I got the whole world in front of me?"" So I said I don t wanna be alone forever, but I can be tonight I don t wanna be alone forever, but I love gypsy life I don t wanna be alone forever Maybe we could see the world together I don t wanna be alone forever, but I can be tonight! Tonight! So I just packed my baggage, and Said goodbye to family and friends And took a road to nowhere on my own Like Dorothy on a yellow brick Hope my ruby shoes get us there quick  Cause I left everyone I love at home And I don t wanna be alone forever, but I can be tonight I don t wanna be alone forever, but I love gypsy life I don t wanna be alone forever Maybe we could see the world together I don t wanna be alone forever, but I can be tonight! Tonight!  Cause I m, I m, I m, I m, I m, I m a gypsy, gypsy, gypsy, I m I m, I m, I m, I m, I m, I m a gypsy, gypsy, gypsy, I m I m, I m, I m, I m, I m, I m a gypsy, gypsy, gypsy, I m I m, I m, I m, I m, I m, I m gypsy, gypsy, gypsy, I m And then he asked me, he said: ""Baby, why do we love each other?"" I said: ""Honey, it s simple It s the way that you love and treat your mother"" Thought that I would be alone forever But I won t be tonight I m a man without a home, but I think With you, I could spend my life And you ll be my little gypsy princess Pack your bags, and we can chase the sunset Bust the rear view, and fire up the jets  Cause it s you and me Baby, for life!  If you go with me  For life!  See the world with me   Cause I m, I m, I m, I m, I m, I m a gypsy, gypsy, gypsy, I m I m, I m, I m, I m, I m, I m a gypsy, gypsy, gypsy, I m Russia, UK, Paris, I m Italian, Asian kompai Africa, India, I m gypsy, gypsy, gypsy, I m Latin American, I don t speak German, but I try Someday in Jakarta, I m American, I m gypsy, I Bangkok, Australia, Malaysia, Sweden, Finland, Norway Be my home just for the day I m a gypsy, gypsy, gypsy, hey "
40,"I am so fab Check out, I m blonde, I m skinny, I m rich And I m a little bit of a bitch I wanna dress you up in silk taffeta Tailor these clothes to fit your guilt, what s your size? This purse can hold my black card and tiara Versace promises I will, Dolce Vita What do you wanna wear this spring? What do you think is the new thing? What do you wanna wear this season? Donatella  I m smokin   em on full tank of gas  Mi-mi-bella  I m a rich bitch, I m the upper class  All of the day  I m the pearl to your oyster, I m a babe  I m gonna smoke Marlboro Lights and drink champagne  I smoke Marlboro Reds and drink champagne  Donatella  Cause she walks so bad like it feels so good Listen to her radiate, her magic Even though she knows she s misunderstood Voodoo, voodoo, voo-don-na-na Walk down the runway, but don t puke, it s okay You just had a salad today, boulangerie Just ask your gay friends their advice before you Get a spray tan on holiday in Taipei What do you wanna wear this spring? What do you think is the new thing? What do you wanna wear this season? Donatella  I m smokin   em on full tank of gas  Mi-mi-bella  I m a rich bitch, I m the upper class  All of the day  I m the pearl to your oyster, I m a babe  I m gonna smoke Marlboro Lights and drink champagne  I smoke Marlboro Reds and drink champagne  Donatella  Cause she walks so bad like it feels so good Listen to her radiate, her magic Even though she knows she s misunderstood Voodoo, voodoo, voo-don-na-na Check it out, take it in  Cause that bitch, she s so thin  Voo-don-na-na  She s so rich and so blonde She s so fab, it s beyond What do you wanna wear this spring? What do you think is the new thing? What do you wanna wear this season? Donatella, Donatella, all of the day I m gonna wear designer and forget your name Donatella Donatella  Cause she walks so bad like it feels so good Listen to her radiate, her magic Even though she knows she s misunderstood Voodoo, voodoo, voo-don-na-na Voo-don-na-na "
41,"Hey there sugar baby saw you twice at the pop show. You taste just like glitter mixed with rock and roll. I like you a lot, lot, Think you re really hot, hot. Know you think you re special when we dance real crazy, Glamophonic, electronic, d-d-disco baby. I like you a lot, lot, All we want is hot, hot. Boys, Boys, Boys. We like boys in cars. Boys, Boys, Boys. Buy us drinks in bars. Boys, Boys, Boys. With hairspray and denim, and Boys, Boys, Boys. We love them! We love them! Ohh, oh oh oh- uh-ohhhh-oooo-wuh-ohh Ohh, oh oh oh- uh-ohhhh-oooo-wuh-ohh Baby is a bad boy with some retro sneakers. Let s go see The Killers and make out in the bleachers. I like you a lot, lot, Think you re really hot, hot, Let s go to the party heard our buddy s the DJ. Don t forget my lipstick, I left it in your ashtray. I like you a lot, lot, All we want is hot, hot. Boys, Boys, Boys. We like boys in cars. Boys, Boys, Boys. Buy us drinks in bars. Boys, Boys, Boys. With hairspray and denim, and Boys, Boys, Boys. We love them! We love them! Boys, Boys, Boys. We like boys in cars. Boys, Boys, Boys. Buy us drinks in bars. Boys, Boys, Boys. With hairspray and denim, and Boys, Boys, Boys. We love them! We love them! I m not loose, I like to party. Let s get lost in your Ferrari, Not psychotic or dramatic, I like boys and that is that. Love it when you call me ""legs"", In the morning buy me eggs, Watch your heart when we re together. Boys like you love me for ever. Ohh, oh oh oh- uh-ohhhh-oooo-wuh-ohh Ohh, oh oh oh- uh-ohhhh-oooo-wuh-ohh Ohh, oh oh oh- uh-ohhhh-oooo-wuh-ohh Ohh, oh oh oh- uh-ohhhh-oooo-wuh-ohh Boys, Boys, Boys. We like boys in cars. Boys, Boys, Boys. Buy us drinks in bars. Boys, Boys, Boys. With hairspray and denim, and Boys, Boys, Boys. We love them! We love them! Boys, Boys, Boys. We like boys in cars. Boys, Boys, Boys. Buy us drinks in bars. Boys, Boys, Boys. With hairspray and denim, and Boys, Boys, Boys. We love them! We love them! Boys, Boys, Boys. We like boys in cars. Boys, Boys, Boys. Buy us drinks in bars. Boys, Boys, Boys. With hairspray and denim, and Boys, Boys, Boys. We love them! We love them! "
42,"Don t be scared I ve done this before Show me your teeth Show me your teeth Show me your teeth Don t want no money  want your money  That shit s ugly Just want your sex  want your sex  Take a bite of my bad girl meat  bad girl meat  Take a bite of me Show me your teeth Let me see your mean Got no direction  no direction  I need direction Just got my vamp  got my vamp  Take a bite of my bad girl meat  bad girl meat  Take a bite of me, boy Show me your teeth The truth is sexy Tell me something that ll save me I need a man who makes me alright  man who makes me alright  Just tell me when it s alright Tell me something that ll change me I m gonna love you with my hands tied Show me your teeth  just tell me when  Show me your teeth  open your mouth, boy  Show me your teeth  show me what you got  Show me your teeth, teeth, teeth, teeth Got no salvation  no salvation  Got no salvation Got no religion  no religion  My religion is you Take a bite of my bad girl meat  bad girl meat  Take a bite of me, boy Show me your teeth I m a tough bitch Got my addictions  my addictions  And I love to fix  em  and I love to fix  em  No one s perfect Take a bite of my bad girl meat  bad girl meat  And I m not a bad woman Show me your teeth I just need a little guidance Tell me something that ll save me I need a man who makes me alright  man who makes me alright  Just tell me when it s alright Tell me something that ll change me I m gonna love you with my hands tied Show me your teeth  just tell me when  Show me your teeth  open your mouth, boy  Show me your teeth  show me what you got  Show me your teeth, teeth, teeth, teeth Show me your teeth My religion is you My religion is you Help, need a man Now show me your fangs Help, need a man Now show me your fangs  my religion is you  Help, need a man Now show me your fangs Help, need a man Now show me your fangs Help, need a man  my religion is you  Now show me your fangs Help, need a man Now show me your fangs Help, need a man Now show me your fangs Help, need a man Now show me your fangs Tell me something that ll save me I need a man who makes me alright  man who makes me alright  Just tell me when it s alright Tell me something that ll change me I m gonna love you with my hands tied Show me your teeth  just tell me when  Show me your teeth  open your mouth, boy  Show me your teeth  show me what you got  Show me your teeth, teeth, teeth, teeth Show me your teeth It s not how big, it s how mean It s not how big, it s how mean Show me your teeth Show me your teeth Show me your teeth Show me your teeth Show me your teeth  open your mouth, boy  Show me your teeth  my religion is you  Show me your teeth, teeth, teeth  show me your teeth  Show me your teeth Show me your teeth  I just need a little guidance  Show me your teeth Show me your teeth Show me your teeth  show me your teeth  Show me your teeth  come on  Show me your teeth, teeth, teeth, teeth "
43,"Come to me In all your glamour and cruelty Just do that thing that you do And I ll undress you Keep it tight Sometimes the simplest move is right The melody that you choose Can rescue you A hybrid can withstand these things My heart can beat with bricks and strings My ARTPOP could mean anything We could, we could belong together  ARTPOP  We could, we could belong together  ARTPOP  We could, we could belong together  ARTPOP  ARTPOP, ARTPOP Come to me With all your subtext and fantasy Just do that thing that you do In a perverse hue Lovers  kites Are flown on beaches for public sight The color palette you choose Can profit you A hybrid can withstand these things My heart can beat with bricks and strings My ARTPOP could mean anything Could try to sell you out, or I Could show you all the reasons why My ARTPOP could mean anything We could, we could belong together  ARTPOP  We could, we could belong together  ARTPOP  We could, we could belong together  ARTPOP  ARTPOP, ARTPOP Brushes with darkness won t help you create Your destiny of self But ARTPOP could mean anything Anything I try to sell myself, but I am really laughing Because I just love the music, not the bling Music, not the bling We could, we could belong together  ARTPOP  We could, we could belong together  ARTPOP  We could, we could belong together  ARTPOP  ARTPOP, ARTPOP We could, we could belong together  ARTPOP  We could, we could belong together  ARTPOP  We could, we could belong together  ARTPOP  ARTPOP, ARTPOP Free my mind, ARTPOP You make my heart stop "
44,"Yeah Turn the mic up I, I feel good, I walk alone But then I trip over myself, and I fall I, I stand up, and then I m okay But then you print some shit That makes me wanna scream So do what you want What you want with my body Do what you want Don t stop, let s party Do what you want What you want with my body Do what you want What you want with my body Write what you want Say what you want about me If you re wondering, know that I m not sorry Do what you want What you want with my body What you want with my body You can t have my heart, and You won t use my mind, but Do what you want with my body Do what you want with my body You can t stop my voice  cause You don t own my life, but Do what you want with my body Do what you want with my body Early morning, longer nights Tom Ford, private flights Crazy schedule, fast life I wouldn t trade it in  cause it s our life  Let s slow it down  I could be the drink in your cup I could be the green in your blunt Your pusher man, yeah, I got what you want You wanna escape all of the crazy shit You re the Marilyn, I m the president And I d love to hear you say, girl Do what I want Do what I want with your body Do what I want Do what I want with your body Back of the club, taking shots, getting naughty No invitations, it s a private party Do what I want Do what I want with your body Do what I want Do what I want with your body Yeah, we taking these haters, and we roughing  em up And we laying the club like we don t give a fuck You can t have my heart, and You won t use my mind, but Do what you want with my body Do what you want with my body You can t stop my voice  cause You don t own my life, but Do what you want with my body Do what you want with my body Sometimes I m scared, I suppose If you ever let me go I would fall apart If you break my heart So just take my body And don t stop the party You can t have my heart, and  help me now  You won t use my mind, but Do what you want with my body Do what you want with my body You can t stop my voice  cause You don t own my life, but Do what you want with my body Do what you want with my body Do what you want with me What you want with my body Do what you want with me What you want with my body  world  Do what you want with me What you want with my body Do what you want with me What you want with my body World, help me now What you want with my body Do what you want with my body Do what you want with my body What you want with my body  world  "
45,"I killed my former and Left her in the trunk on highway 10 Put the knife under the hood If you find it, send it straight to Hollywood Hahahaha, hahahaha, hahahaha Hahahaha, hahahaha, hahahaha Hahahaha, hahahaha, hahahaha Aura-ah-ah, aura-ah-ah Aura-ah-ah, aura-ah-ah Aura-ah-ah, aura-ah-ah I m not a wandering slave, I am a woman of choice My veil is protection for the gorgeousness of my face You want to pity me  cause was arranged one man to love But in the bedroom, the size of him s more than enough Do you wanna see me naked, lover? Do you wanna peek underneath the cover? Do you wanna see the girl who lives behind the aura? Behind the aura Do you wanna touch me, cosmic lover? Do you wanna peek underneath the cover? Do you wanna see the girl who lives behind the aura? Behind the aura, behind the aura, behind the aura, oh Enigma pop star is fun, she wear burqa for fashion It s not a statement as much as just a move of passion I may not walk on your street or shoot a gun on your soil I hear you screaming, is it because of pleasure or toil? Dance, sex, art, pop, tech Dance, sex, art, pop, tech Do you wanna see me naked, lover? Do you wanna peek underneath the cover? Do you wanna see the girl who lives behind the aura? Behind the aura Do you wanna touch me, cosmic lover? Do you wanna peek underneath the cover? Do you wanna see the girl who lives behind the aura? Behind the aura, behind the curtain, behind the burqa, oh ARTPOP "
46,"Want to I think I love you You got ripped jeans I m only 19 What do you wanna do? You got your cigarette I got my headset We re two of a kind You re spades and I m diamonds And you know that too Yeah you can see clearly That I am the one you want But I must admit that I m everything you re not Yeah I am red, you are blue I m old school and you re so new But I guess I could forgive you tonight When you re cold, I like to burn I cut lines, you wait you turn But I guess I could forgive you tonight Tonight, tonight, tonight Don t shoot My heart is on mute Our physical dream Is only skin deep How do you wanna groove? Bang Bang Should hear my gun ring You re mine, you re there You ll hear that I am all up inside your head Now I can see clearly That I am the one you want But I must admit that I m everything you re not Yeah I am red, you are blue I m old school and you re so new But I guess I could forgive you tonight When you re cold, I like to burn I cut lines, you wait your turn But I guess I could forgive you tonight Tonight, tonight, tonight You won t forget me when I m gone This feels so good, it can t be wrong I recommend a one night stand I know we re just friends But you re my kind of man Just for tonight Just for tonight Just for tonight Even though I m red, you are blue I m old school and you re so new I know we could be great for tonight When you re cold, I ll make it burn You ll never have to wait your turn Yeah I guess I could forgive you tonight Yeah I am red, you are blue I m old school and you re so new But I guess I could forgive you tonight When you re cold, I like to burn I cut lines, you wait your turn But I guess I could forgive you tonight Tonight, tonight, tonight "
47,"That s M O N E Y, so sexy, I Damn, I love the Jag, the jet and the mansion Oh yeah And I enjoy the gifts and trips to the islands Oh yeah It s good to live expensive you know it But my knees get weak, intensive When you give me k-kisses That s money, honey When I m your lover and your mistress That s money, honey When you touch me it s so delicious That s money, honey Baby, when you tear me to pieces That s money, honey That s M O N E Y, so sexy, I That s money, honey Damn, I d love a boat by the beach on the west coast Oh yeah And I d enjoy some fine champagne while my girls toast Oh yeah It s good to live expensive you know it But my knees get weak, intensive When you give me k-kisses That s money, honey When I m your lover and your mistress That s money, honey When you touch me it s so delicious That s money, honey Baby, when you tear me to pieces That s money, honey You know I appreciate the finer things But it s not what makes me happiest, baby  I can do without it, babe  Your tender loving s more than I can handle Never burn out this candle, baby, baby K-k-kisses That s money, honey When I m your lover and your mistress That s money, honey When you touch me it s so delicious That s money, honey Baby, when you tear me to pieces That s money, honey When you give me k-kisses That s money, honey When I m your lover and your mistress That s money, honey When you touch me it s so delicious That s money, honey Baby, when you tear me to pieces That s money, honey When you give me k-kisses That s money, honey When I m your lover and your mistress That s money, honey When you touch me it s so delicious That s money, honey Baby, when you tear me to pieces That s money, honey That s M O N E Y, so sexy, I "
