,songs
23,"Trying to get control Pressure s taking its toll Stuck in the middle zone I just want you alone My guessing game is strong Way too real to be wrong Caught up in your show Yeah, at least now I know It wasn t love, it wasn t love It was a perfect illusion  perfect illusion  Mistaken for love, it wasn t love It was a perfect illusion  perfect illusion  Oh, you were a perfect illusion I don t need eyes to see I felt you touching me High like amphetamine Maybe you re just a dream That s what it means to crush Now that I m waking up I still feel the blow But at least now I know It wasn t love, it wasn t love It was a perfect illusion  perfect illusion  Mistaken for love, it wasn t love It was a perfect illusion  perfect illusion   Where are you?  Cause I can t see you  It was a perfect illusion  but I feel you watching me   Dilated, falling free in a modern ecstasy   Where are you?  Cause I can t see you  It was a perfect illusion  but I feel you watching me   But I feel you watching me  Illusion  but I feel you watching me  Mistaken for love  Where are you?  Cause I can t see you   But I feel you watching me  Mistaken for love  dilated, falling free   In a modern ecstasy  Mistaken for love  in a modern ecstasy   In a modern ecstasy  I m over the show Yeah, at least now I know It wasn t love, it wasn t love It was a perfect illusion  perfect illusion  Mistaken for love, it wasn t love It was a perfect illusion  perfect illusion  Oh, you were a perfect illusion Oh, it was a perfect illusion It was a perfect illusion Somewhere in all the confusion It was a perfect illusion, illusion, illusion It was a perfect illusion Somewhere in all the confusion You were so perfect You were a, you were a perfect illusion "
24,"Make it stop! Silicon, saline, poison, inject me Baby, I m a free bitch I m a free bitch Some girls won t dance to the beat of the track She won t walk away, but she won t look back She looks good, but her boyfriend says she s a mess She s a mess, she s a mess Now the girl is stressed She s a mess, she s a mess She s a mess, she s a mess  Tell  em, girls  Baby loves to dance in the dark  Cause when he s looking, she falls apart Baby loves to dance in the dark Baby loves to dance in the dark  Cause when he s looking, she falls apart Baby loves to dance, loves to dance in the dark  Saline  Run, run, her kiss is a vampire grin The moon lights her way while she s howling at him She looks good, but her boyfriend says she s a tramp She s a tramp, she s a vamp But she still does her dance She s a tramp, she s a vamp But she still kills the dance  Tell  em, girls  Baby loves to dance in the dark  Cause when he s looking, she falls apart Baby loves to dance in the dark Baby loves to dance in the dark  Cause when he s looking, she falls apart Baby loves to dance, loves to dance in the dark In the dark She loves to dance in the dark In the dark She loves, she loves to dance in the dark Marilyn, Judy, Sylvia Tell  em how you feel, girls Work your blonde Benét Ramsey We ll haunt like Liberace Find your freedom in the music Find your Jesus, find your Kubrick You will never fall apart Diana, you re still in our hearts Never let you fall apart Together we ll dance in the dark Baby loves to dance in the dark  Cause when he s looking, she falls apart Baby loves to dance in the dark Baby, yeah Baby loves to dance in the dark  Cause when he s looking, she falls apart Baby loves to dance, loves to dance in the dark In the dark "
25,"I don t speak German But I can if you like- ow Ich schleiban austa be clair Es kumpent madre monstère Aus-be aus-can-be flaugen Begun be üske but-bair Ich schleiban austa be clair Es kumpent madre monstère Aus-be aus-can-be flaugen Fräulein uske-be clair Ich schleiban austa be clair Es kumpent madre monstère Aus-be aus-can-be flaugen Begun be üske but-bair Ich schleiban austa be clair Es kumpent madre monstère Aus-be aus-can-be flaugen Fräulein uske-be clair Ich schleiban austa be clair Es kumpent madre monstère Aus-be aus-can-be flaugen Begun be üske but-bair Ich schleiban austa be clair Es kumpent madre monstère Aus-be aus-can-be flaugen Fräulein uske-be clair I ll take you out tonight Say whatever you like Scheiße, scheiße be mine Scheiße, be mine Put on a show tonight Do whatever you like Scheiße, scheiße be mine Scheiße, be mine When I m on a mission I rebuke my condition If you re a strong female You don t need permission I, I wish that I could dance on a single prayer I, I wish I could be strong without somebody there I, I wish that I could dance on a single prayer I, I wish I could be strong without the scheiße, yeah  Oh, oh, oh, oh-oh  Without the scheiße, yeah  Oh, oh, oh, oh-oh  Without the scheiße, yeah  Oh, oh, oh, oh-oh  Without the scheiße, yeah  Oh, oh, oh, oh-oh  Without the scheiße, yeah  I don t speak German but I wish I could- ow.  Ich schleiban austa be clair Es kumpent madre monstère Aus-be aus-can-be flaugen Begun be üske but-bair Ich schleiban austa be clair Es kumpent madre monstère Aus-be aus-can-be flaugen Fräulein uske-be clair Love is objectified By what men say is right Scheiße, scheiße be mine Bullshit, be mine Blonde high-heeled feminists Enlisting femmes for this Express your womankind Fight for your right When I m on a mission I rebuke my condition If you re a strong female You don t need permission I, I wish that I could dance on a single prayer I, I wish I could be strong without somebody there I, I wish that I could dance on a single prayer I, I wish I could be strong without the scheiße, yeah  Oh, oh, oh, oh-oh  Without the scheiße, yeah  Oh, oh, oh, oh-oh  Without the scheiße, yeah  Oh, oh, oh, oh-oh  Without the scheiße, yeah  Oh, oh, oh, oh-oh  Without the scheiße, yeah  I don t speak German but I wish I could- ow.  I, I, I, I, I I, I, I, I don t speak German I, I, I, I, I But I can if you like I, I, I, I, I I, I, I, I don t speak German I, I, I, I, I But I can if you like I, I wish that I could dance on a single prayer I, I wish I could be strong without permission, yeah I, I wish that I could dance on a single prayer I, I wish I could be strong without the scheiße, yeah  Oh, oh, oh, oh-oh  Without the scheiße, yeah  Oh, oh, oh, oh-oh  Without the scheiße, yeah  Oh, oh, oh, oh-oh  Without the scheiße, yeah  Oh, oh, oh, oh-oh  Without the scheiße, yeah Ich schleiban austa be clair Es kumpent madre monstère Aus-be aus-can-be flaugen Begun be üske but-bair Ich schleiban austa be clair Es kumpent madre monstère Aus-be aus-can-be flaugen Fräulein uske-be clair "
26," Last night  Our lovers  quarrel  I was thinking about you  Hurts more than I can say  And it was kinda dirty  All night  and the way that you looked at me  Help me here  it was kinda nasty, ah  Help me here  it was kinda trashy   Cause I can t help my mind from going there Heard your boyfriend was away this weekend Wanna meet at my place? Heard that we both got nothing to do When I lay in bed, I touch myself and think of you Last night Damn, you were in my sex dreams  you were in my  Doing really nasty things  you were in my dreams  Damn, you were in my sex dreams  you were in my  Making love in my sex dreams We could  I  be caught  just want this to be perfect  We re both convicted criminals of thought   Cause I m broken  Let s white  by the one before  glove the bed  He was kinda nasty, ah  Help me here  and I feel so trashy   Cause we can t hide the evidence in our heads Heard your boyfriend was away this weekend Wanna meet at my place? Heard that we both got nothing to do When I lay in bed, I touch myself and think of you Last night Damn, you were in my sex dreams  you were in my  Doing really nasty things  you were in my dreams  Damn, you were in my sex dreams  you were in my  Making love in my sex dreams  Don t stop the party  Making love in my sex dreams  Let s keep it naughty, yeah  Making love in my sex dreams  Watch me act a fool  Making love in my sex dreams Tomorrow when I run into you Tomorrow when I run into you You could turn to stone or the color of Men petrified by a woman In love, as I am when I lay with you I think of him, I think of him I can t believe I m telling you this But I ve had a couple of drinks and Oh my god Last night Damn, you were in my sex dreams  you were in my  Doing really nasty things  you were in my dreams  Damn, you were in my sex dreams  you were in my  Last night  don t stop the party  Damn, you were in my sex dreams  Let s keep it naughty, yeah  Doing really nasty things  Watch me act a fool  Damn, you were in my sex dreams  Tomorrow when I run into you  Making love in my sex dreams "
27,"I m gonna marry the night I won t give up on my life I m a warrior queen Live passionately tonight I m gonna marry the dark Gonna make love to the stark I m a soldier to my own emptiness I m a winner I m gonna marry the night I m gonna marry the night I m gonna marry the night I m gonna marry the night I m not gonna cry anymore I m gonna marry the night Leave nothing on these streets to explore Ma-ma-ma-marry, ma-ma-ma-marry Ma-ma-ma-marry the night Oh, ma-ma-marry, ma-ma-ma-marry Ma-ma-ma-marry the night I m gonna lace up my boots Throw on some leather and cruise Down the street that I love In my fishnet gloves, I m a sinner Then I ll go down to the bar But I won t cry anymore I ll hold my whiskey up high Kiss the bartender twice, I m a loser I m gonna marry the night I m gonna marry the night I m gonna marry the night I m not gonna cry anymore I m gonna marry the night Leave nothing on these streets to explore Ma-ma-ma-marry, ma-ma-ma-marry Ma-ma-ma-marry the night Oh, ma-ma-marry, ma-ma-ma-marry Ma-ma-ma-marry the night Nothing s too cool to take me from you New York is not just a tan that you ll never loose Love is the new denim or black Skeleton guns are wedding bells in the attic Get Ginger ready, climb to El Camino front Won t poke holes in the seats with my heels  Cause that s where we make love Come on and run Turn the car on and run I m gonna marry the night I m gonna burn a hole in the road I m gonna marry the night Leave nothing on these streets to explore Ma-ma-ma-marry, ma-ma-ma-marry Ma-ma-ma-marry the night Oh, ma-ma-marry, ma-ma-ma-marry Ma-ma-ma-marry the night Oh, ma-ma-marry, ma-ma-ma-marry Ma-ma-ma-marry the night I m gonna marry  marry , marry  marry  I m gonna marry  marry , marry  marry  Come on, come on The night, the night, the night  I m gonna  The night, the night, the night  I m gonna  The night, the night, the night The night, the night, the night The night, the night, the night "
28,"Eh-eh, eh-eh Ye-ha, ye-ha Eh-eh, eh-eh Aha-aha Eh-eh, eh-eh Ye-ha, ye-ha Eh-eh, eh-eh Aha-aha I love that lavender blonde The way she moves, the way she walks I touch myself, can t get enough And in the silence of the night Through all the tears and all the lies I touch myself, and it s alright Just give in Don t give up, baby Open up your heart and your mind to me Just know when That glass is empty That the world is gonna bend, yeah Happy in the club, with a bottle of red wine Stars in our eyes  cause we re having a good time Eh-eh, eh-eh So happy I could die Be your best friend, yeah, I ll love you forever Up in the clouds, we ll be higher than ever Eh-eh, eh-eh So happy I could die, and it s alright Eh-eh, eh-eh Ye-ha, ye-ha Eh-eh, eh-eh Aha-aha Eh-eh, eh-eh Ye-ha, ye-ha Eh-eh, eh-eh Aha-aha I am as vain as I allow I do my hair, I gloss my eyes I touch myself all through the night And when something falls out of place I take my time, I put it back I touch myself till I m on track Just give in Don t give up, baby Open up your heart and your mind to me Just know when That glass is empty That the world is gonna bend, yeah Happy in the club, with a bottle of red wine Stars in our eyes  cause we re having a good time Eh-eh, eh-eh So happy I could die Be your best friend, yeah, I ll love you forever Up in the clouds, we ll be higher than ever Eh-eh, eh-eh So happy I could die, and it s alright So happy I could die, and it s alright So happy I could die, and it s alright Eh-eh, eh-eh Ye-ha, ye-ha Eh-eh, eh-eh Aha-aha Eh-eh, eh-eh Ye-ha, ye-ha Eh-eh, eh-eh Aha-aha Happy in the club, with a bottle of red wine Stars in our eyes  cause we re having a good time Eh-eh, eh-eh So happy I could die Be your best friend, yeah, I ll love you forever Up in the clouds, we ll be higher than ever Eh-eh, eh-eh So happy I could die, and it s alright Happy in the club, with a bottle of red wine Stars in our eyes  cause we re having a good time Eh-eh, eh-eh So happy I could die Be your best friend, yeah, I ll love you forever Up in the clouds, we ll be higher than ever Eh-eh, eh-eh So happy I could die, and it s alright "
29,"In your brown eyes, walked away In your brown eyes, couldn t stay In your brown eyes, you watch her go And turn the record on And wonder what went wrong What went wrong If everything was everything But everything is over Everything could be everything If only we were older Guess it s just a silly song about you And how I lost you And your brown eyes In your brown eyes, I was feeling low Cause they re brown eyes and you never know Got some brown eyes, but a soft face I knew that it was wrong So baby, turn the record on Play that song Where everything was everything But everything is over Everything could be everything If only we were older I guess its just a silly song about you And how I lost you And your brown eyes Brown eyes Everything was everything But baby it s the last show Everything could be everything But it s time to say goodbye so Get your last fix, and your last hit Grab your old girl with her new tricks Honey yeah, it s no surprise I got lost in your brown eyes In your brown eyes Brown, brown eyes Your brown eyes Brown, brown eyes Got some brown eyes Brown, brown eyes Your brown eyes "
30,"Don t call me Gaga I ve never seen one like that before Don t look at me like that You amaze me He ate my heart, he a-a-ate my heart  you, little monster  He ate my heart, he a-a-ate my heart out  you amaze me  Ate my heart, he a-a-ate my heart He ate my heart, he a-a-ate my heart Look at him, look at me That boy is bad, and honestly He s a wolf in disguise But I can t stop staring in those evil eyes I asked my girlfriend if she d seen you  round before She mumbled something while we got down on the floor, baby ""We might ve fucked, not really sure, don t quite recall But something tells me that I ve seen him, yeah"" That boy is a monster  m-m-m-monster  That boy is a monster  m-m-m-monster  That boy is a monster  m-m-m-monster  That boy is a monster, -er, -er-er-er He ate my heart  I love that girl  He ate my heart  wanna talk to her, she s hot as hell  He ate my heart  I love that girl  He ate my heart  wanna talk to her, she s hot as hell  He licked his lips, said to me ""Girl, you look good enough to eat"" Put his arms around me Said, ""Boy, now get your paws right off of me"" I asked my girlfriend if she d seen you  round before She mumbled something while we got down on the floor, baby ""We might ve fucked, not really sure, don t quite recall But something tells me that I ve seen him, yeah"" That boy is a monster  m-m-m-monster   could I love him?  That boy is a monster  m-m-m-monster   could I love him?  That boy is a monster  m-m-m-monster   could I love him?  That boy is a monster, -er, -er-er-er He ate my heart  I love that girl  He ate my heart  wanna talk to her, she s hot as hell  He ate my heart  I love that girl  He ate my heart  wanna talk to her, she s hot as hell  He ate my heart, he ate my heart Instead, he s the monster in my bed He ate my heart, he ate my heart Instead, he s the monster in my bed I wanna just dance, but he took me home instead Uh-oh, there was a monster in my bed We French kissed on a subway train He tore my clothes right off He ate my heart, and then he ate my brain Uh-oh, uh-oh  I love that girl   Wanna talk to her, she s hot as hell  He ate my heart  uh-oh  He a-a-ate my heart  I love that girl  He ate my heart  Wanna talk to her, she s hot as hell  That bo-, that bo-, that bo-, that bo-, that bo-, that bo- That boy is a monster  m-m-m-monster   could I love him?  That boy is a monster  m-m-m-monster   could I love him?  That boy is a monster  m-m-m-monster   could I love him?  That boy is a monster, -er, -er-er-er That boy is a monster  m-m-m-monster   could I love him?  That boy is a monster  m-m-m-monster   could I love him?  That boy is a monster  m-m-m-monster   could I love him?  That boy is a monster, -er, -er-er-er "
31,"Cher: I don t know why you hurt inside, or what was said to make you cry. I hope that you can see, you are the greatest thing to me. I dont wa-wanna waste another day, without telling you that baby youre great. And I can see it written on your face, G-R-E-A-T, its all that you can be.  Cause when I m with you, I fall apart, to heal your permanently broken heart. Baby, you re the greatest to me, know no matter what, what, what. I don t know why you hurt inside, or what was said to make you cry. I hope that you can see, you are the greatest thing to me. And when, you re feeling like you re not enough, I ll give you wings, Ill lift you up. I hope that you can see, you are the greatest, greatest thing to me. Lady Gaga: When all your thoughts are dark and insecure, Ill build you a light, Cause baby Im sure that loving you has made me better, I take on your shadows, and make sure that you shine. Cher and Lady Gaga:  Cause when I m with you, I fall apart, to heal your permanently broken heart. Baby, you re the greatest to me, know no matter what, what, what. I don t know why you hurt inside, or what was said to make you cry. I hope that you can see, you are the greatest thing to me. And when, youre feeling like you re not enough, I ll give you wings, Ill lift you up. I hope that you can see, you are the greatest, greatest thing to me. Cher: The greatest thing, greatest thing, greatest thing to me, gonna re-repeat myself so I know that yall are listening. The greatest thing, greatest thing, greatest thing to me, gonna re-repeat myself so I know that yall are listening. Cher and Lady Gaga:  Cause when I m with you, I fall apart, to heal your permanently broken heart. Baby, you re the greatest to me, know no matter what, what, what. I don t know why you hurt inside, or what was said to make you cry. I hope that you can see, you are the greatest thing to me. And when, youre feeling like you re not enough. I ll give you wings, Ill lift you up. I hope that you can see, you are the greatest, greatest thing to me. "
32,"Take my hand, stay, Joanne Heaven s not ready for you Every part of my aching heart Needs you more than the angels do Girl, where do you think you re goin ? Where do you think you re goin , goin , girl? Girl, where do you think you re goin ? Where do you think you re goin , goin , girl? If you could, I know that you d stay We both know things don t work that way I promised I wouldn t say goodbye So I grin, and my voice gets thin Girl, where do you think you re goin ? Where do you think you re goin , goin , girl? Girl, where do you think you re goin ? Where do you think you re goin , goin , girl? Honestly, I know where you re goin  And, baby, you re just moving on And I ll still love you even if I can t see you anymore Can t wait to see you soar Girl, where do you think you re goin ? Where do you think you re goin , goin , girl? Girl, where do you think you re goin ? Where do you think you re goin , goin , girl? "
33,"I ll undress you,  cause you re tired Cover you as you desire When you fall asleep inside my arms May not have the fancy things But I ll give you everything You could ever want, it s in my arms So baby tell me yes And I will give you everything So baby tell me yes And I will be all yours tonight So baby tell me yes And I will give you everything I will be right by your side If I can t find the cure, I ll I ll fix you with my love No matter what you know, I ll I ll fix you with my love And if you say you re okay I m gonna heal you anyway Promise I ll always be there Promise I ll be the cure  be the cure  Rub your feet, your hands, your legs Let me take care of it, babe Close your eyes, I ll sing your favorite song I wrote you this lullaby Hush now baby, don t you cry Anything you want could not be wrong So baby tell me yes And I will give you everything So baby tell me yes And I will be all yours tonight So baby tell me yes And I will give you everything I will be right by your side If I can t find the cure, I ll I ll fix you with my love No matter what you know, I ll I ll fix you with my love And if you say you re okay I m gonna heal you anyway Promise I ll always be there Promise I ll be the cure  be the cure  I ll fix you with my love  I ll fix you with my love-lo-love  I ll fix you with my love  I ll fix you with my love-lo-love  If I can t find the cure, I ll I ll fix you with my love No matter what you know, I ll I ll fix you with my love And if you say you re okay I m gonna heal you anyway Promise I ll always be there Promise I ll be the cure  be the cure  Promise I ll be the cure  be the cure  I ll fix you with my love "
34,"Rocket number nine, take off to the planet, to the planet Venus Aphrodite lady, seashell bikini, garden panty, Venus Let s blast off to a new dimension, in your bedroom, Venus Aphrodite lady, seashell bikini, get with me, Venus I can t help the way I m feeling Goddess of love, please take me to your leader I can t help, I keep on dancing Goddess of love, Goddess of love Take me to your planet  to the planet  Take me to your planet  to the planet  Take me to your leader  to the planet  Your leader, your leader  to the planet  Take me to your planet  to the planet  Take me to your planet  to the planet  Take me to your Venus  to the planet  Your Venus, your Venus  to the planet  When you touch me, I die just a little inside I wonder if this could be love, this could be love  Cause you re out of this world, galaxy, space and time I wonder if this could be love  Venus  Have an oyster, baby, it s aphrod-i-sy Act sleazy, Venus Worship to the land, a girl from the planet To the planet  to the planet  I can t help the way I m feeling Goddess of love, please take me to your leader I can t help, I keep on dancing Goddess of love, Goddess of love Take me to your planet  to the planet  Take me to your planet  to the planet  Take me to your leader  to the planet  Your leader, your leader  to the planet  Take me to your planet  to the planet  Take me to your planet  to the planet  Take me to your Venus  to the planet  Your Venus, your Venus  to the planet  When you touch me, I die just a little inside I wonder if this could be love, this could be love  Cause you re out of this world, galaxy, space and time I wonder if this could be love, this could be love Wonder if this could be love, this could be... Goddess of love Wonder if this could be love, Venus Neptune, go Now serve, Pluto Saturn, Jupiter, Mercury, Venus, uh ha Uranus, don t you know my ass is famous? Mars, now serve for the gods Earth, serve for the stars When you touch me, I die just a little inside I wonder if this could be love, this could be love  Cause you re out of this world, galaxy, space and time I wonder if this could be love, this could be love Wonder if this could be love, this could be... Goddess of love Wonder if this could be love Venus "
35,"I don t want to rule the world It s a change I m here to see I walk along on a lonely road Of many wonders to believe You can try to hit the top Or selling it out a masterpiece You got a throne full of gold I got someone to believe This ain t about kings or queens In a battle you and me Do you need a dose of truth? What am I supposed to do? How can you deal with it? Do you just avoid the guilt? There s something you gotta know If you can t deal with me Shut your mouth Sip on that tea It s been so long Since I ve had a sip and I get this feeling I need a green detox, the truth will be the winner tonight This ain t about kings or queens In a battle you and me Do you need a dose of truth? What am I supposed to do? How can you deal with it? Do you just avoid the guilt? This ain t about kings or queens In a battle you and me Do you need a dose of truth? What am I supposed to do? How can you deal with it? Do you just avoid the guilt? It s been so long Since I ve had a sip and I get this feeling I need a green detox, the truth will be the winner tonight This ain t about kings or queens In a battle you and me Do you need a dose of truth? What am I supposed to do? How can you deal with it? Do you just avoid the guilt? "
