,songs
65,"Your love is rain, my heart the flower, I need your love or I will die My very life is your power, will I wither and fade or bloom to the sky Agua de Beber, Give the flower water to drink Agua de Beber, Give the flower water to drink The rain can fall on distant deserts, the rain can fall upon the sea The rain can fall upon the flower, since the rain has to fall let it fall on me Agua de Beber, Give the flower water to drink Agua de Beber, Give the flower water to drink "
66,"You make me feel so young. You make me feel as though spring has sprung. And every time I see you grin, I m such a happy individual. The moment that you speak, I want to go and play hide and seek. I wanna go and bounce the moon, Just like a toy balloon. You and I Are just like a couple of tots, Running across a meadow Pickin  up lots of forget-me-nots. You make me feel so young. You make me feel there are songs to be sung, Bells to be rung, And a wonderful fling to be flung. And even when I m old and gray, I m going to feel the way I do today Because you make me feel so young. You make me feel so young. You make me feel as though spring has sprung. And every time I see you grin, I m such a happy individual. The moment that you speak, I want to go and play hide and seek. I wanna go and bounce the moon, Just like a toy balloon. You and I Are just like a couple of tots, Running across a meadow Pickin  up lots of forget-me-nots. You make me feel so young. You make me feel there are songs to be sung, Bells to be rung, And a wonderful fling to be flung. And even when I m old and gray, I m going to feel the way I do today Because you make me feel so young. "
67,"Unfortunately, we are not authorized to show these lyrics "
68,"Chicago, Chicago that toddling town Chicago, Chicago I will show you around - I love it Bet your bottom dollar you lose the blues in Chicago, Chicago The town that Billy Sunday couldn t shut down On State Street, that great street, I just want to say They do things they don t do on Broadway They have the time, the time of their life I saw a man, he danced with his wife In Chicago, Chicago my home town Chicago, Chicago that toddlin  town Chicago, Chicago I ll show you around - I love it Bet your bottom dollar you lose the blues in Chicago, Chicago The town that Billy Sunday could not shut down On State Street, that great street, I just want to say They do things that they never do on Broadway -- say They have the time, the time of their life I saw a man and he danced with his wife In Chicago, Chicago, Chicago -- that s my home town "
69,Once upon a time A girl with moonlight in her eyes Put her hand in mine And said she loved me so But that was once upon a time Very long ago Once upon a hill We sat beneath a willow tree Counting all the stars and waiting for the dawn But that was once upon a time Now the tree is gone How the breeze ruffled through her hair How we always laughed as though tomorrow wasn t there We were young and didn t have a care Where did it go Once upon a time The world was sweeter than we knew Everything was ours How happy we were then But somehow once upon a time Never comes again Once upon a time Never comes again 
70,"If I don t see her each day, I miss her Gee what a thrill, each time I kiss her Believe me, I ve got a case On Nancy, with the laughing face She takes the winter and she makes it summer And summer could take a few lessons from her Picture a tomboy in lace That s Nancy with the laughing face Have you ever heard mission bells ringing Well she ll give you the very same glow When she speaks you would think it was singing Just hear her say ""hello"" I swear to goodness, you can t resist her Sorry for you she has no sister No angel could replace Nancy, with the laughing face "
71,"For once in my life I have someone who needs me someone I ve needed so long For once I m afraid I can go where life leads me and somehow know I ll be strong For once I can touch what my heart used to dream of long before I knew, someone warm like you would make my dreams come true For once in my life I won t let sorrow hurt me not like it s hurt me before For once I have something I know won t desert me and I m not alone anymore For once I can say; this is mine you won t take it Long as I know I have love I can make it For once my life I have someone who needs me - Instrumental break - For once I can say; this is mine you can t take it Long as I know I got love I can make it For once in my life I ve got someone Yeah, for once in my life I found someone For once in my life, I ve got someone who needs me "
72,"It s very nice to go trav ling To Paris, London and Rome It s oh, so nice to go trav ling But it s so much nicer Yes, it s so much nicer to come home It s very nice to just wander The camel route to Iraq It s oh, so nice to just wander But it s so much nicer Yes, it s oh so nice to wander back The mam selles and frauleins and the senoritas are sweet But they can t compete  cause they just don t have What the models have on Madison Ave It s very nice to be footloose With just a toothbrush and comb It s oh so nice to be footloose But your heart starts singin  When you re homeward wingin  across the foam And you know your fate is Where the Empire State is All you contemplate is The view from Miss Liberty s dome It s very nice to go trav ling But it s oh so nice to come home You will find the madchen and the gay muchachas are rare But they can t compare with that sexy line That parades each day at Sunset and Vine It s quite the life to play gypsy And roam as gypsies will roam It s quite the life to play gypsy But your heart starts singin  When you re homeward wingin  across the foam And the Hudson River Makes you start to quiver Like the latest flivver That s simply drippin  with chrome It s very nice to go trav ling But it s oh so nice to come home No more customs Burn the passport No more packing and unpacking Light the home fires Get my slippers Make a pizza "
